{
  "$schema": "../../docs/project/schema/v2-m23-release-contract.schema.json",
  "schema_version": "openttd-rl-v2-m23-release-contract-1",
  "schema_sha256": "29b1cbd9c46aab49e36b374aaebe39223f4bf5200b05e44887c8b9fdbad6b0a8",
  "snapshot_date": "2026-08-03",
  "contract_id": "m23-v2-release-and-publication-v1",
  "semantic_version": 1,
  "status": "FROZEN",
  "release": {
    "version": "2.0.0",
    "tag": "v2.0.0",
    "name": "OpenTTD RL V2",
    "repository": "https://github.com/goldbar123467/openttd-cuda-rl",
    "branch": "main",
    "license": "GPL-2.0-only",
    "artifact_name": "openttd-rl-v2.0.0-models-checkpoints-and-evidence.tar.gz",
    "artifact_root": "openttd-rl-v2.0.0"
  },
  "foundations": {
    "accepted_g22_commit": "e027ab69a39cbe929db0fddafebbc1696b26e0d7",
    "openttd_release": "15.3",
    "openttd_upstream_commit": "29f808ef0022064e6d9a83c8476d1e0f4686af86",
    "corrected_m22_source_tree": "f8985045f9ba14bad1e46a81cb58fdbb8037f277",
    "files": [
      {"path": "config/v2/m22-learning-contract.json", "sha256": "f3ae8f89dfb6edf19b910c55f55845279b77ddd7be5adbd1db244984f968b07b"},
      {"path": "config/v2/m22-native-corpus.json", "sha256": "0af952bb840bca2a80a577e2a2446845f2db749d7efbaeb06af4b94418ff6725"},
      {"path": "config/v2/m22-training-evidence.json", "sha256": "1a0019a83816981ca355ae7c51f175fc482b2afecc45413d23d55a9ae2c177b1"},
      {"path": "config/v2/m22-qualification-evidence.json", "sha256": "192f784c54420f99e01384c4c453e2df651c2d87b479c0bee3dc46bf3b5a3798"},
      {"path": "config/v2/m22-followup-v2-evaluation-evidence.json", "sha256": "21e53fa3c7f7f5a15fcd9f199f0a59920082f3e03b8292ed968da44e9dc319ec"},
      {"path": "config/v2/m22-followup-runtime-source.json", "sha256": "bea83243dc68f72ebd14d1d944a800f0087c9283d7c0f3421b854d8c8adba15c"},
      {"path": "docs/project/G22_GATE_REPORT.md", "sha256": "5043d91b0fafb04c6fef44a57ad8123f3d2c3469b2c5d75fa6c6b81cae35254c"},
      {"path": "config/v2/m14-competition-manifest.json", "sha256": "2218667f2ca74740bfbe57af3a978eb2ee33f925eb6e2faaed03394a04bb98ee"},
      {"path": "config/v2/m21-content-lock.json", "sha256": "31d2ebd04f8eea4226e1f50a4dba28b1f11567bc2f7a1b33d059102d2346e266"},
      {"path": "config/v1/m10-model-package-contract.json", "sha256": "174689b55f7c47a23d5e435b53a889343b07d9f88c3c83df648c011dcb77caf8"},
      {"path": "config/v1/m11-playback-contract.json", "sha256": "7ae56b5c450bfc4c8d9aa0147a4da5ed182b64f5cc73172a48b62ec586c68bf4"},
      {"path": "config/v1/m12-release-contract.json", "sha256": "59e56686bbd09a924e64f01958ab8d1d0b41f5625ad857a3976b4a6d67a4dc1c"},
      {"path": "config/v1/m13-publication-contract.json", "sha256": "5ff5cc2ff085e0b5d3c9af8b0c76af22aadd9f48ac868290e84963c48281bb67"}
    ],
    "v1_boundary": "released-v1-tag-and-package-remain-byte-unchanged-and-revalidated-at-g23"
  },
  "checkpoint_packages": {
    "format": "openttd-rl-v2-m22-checkpoint-package-1",
    "directory": "checkpoints/<architecture-id>/<checkpoint-id>",
    "id_algorithm": "m22-checkpoint-content-address-v1",
    "copy_policy": "exact-byte-copy-no-rewrite-no-symlink-no-extra-file",
    "maximum_total_bytes_per_checkpoint": 33554432,
    "inventory": [
      "COMMITTED",
      "m22.manifest",
      "model.pt",
      "optimizer.pt",
      "runtime.pt",
      "selection.json",
      "trainer-state.bin"
    ],
    "architectures": [
      {
        "architecture_id": "monolithic-generalist-v1",
        "role": "development-selected-and-g22-accepted-in-game-policy",
        "parameter_count": 1457520,
        "run_seed": 1636894266,
        "update": 32,
        "checkpoint_id": "03894fd1238b69b6724d82eb441380312be4e8226efa602fa5e43972f7fa9f5f",
        "files": [
          {"name": "COMMITTED", "bytes": 65, "sha256": "1bce450303dd9c4d7eb43d4b8989edd01078f35cfa1287768ab10772fa7011e0"},
          {"name": "m22.manifest", "bytes": 806, "sha256": "82e2d0ed0b49f2a3774b7a8a6187b7b7540d74149941f4e91693f1a8f3e4297e"},
          {"name": "model.pt", "bytes": 5882820, "sha256": "ad98f92fa9dfd07b14a49373676746c87419cafcad81bc834dd8bdf435d432c3"},
          {"name": "optimizer.pt", "bytes": 11530487, "sha256": "c4c9177f02f4bed840d5f9a671da16381682b74dc02c23bc199734690317eaff"},
          {"name": "runtime.pt", "bytes": 10863, "sha256": "5f9869a7ae0e6d9ba8d2b3caeca7ab02d8331f51087ccb336a4cabb25df0c2d7"},
          {"name": "selection.json", "bytes": 103, "sha256": "b8301da160f25aa27f759abc4da50f212d90e7bcc03c5f1989e1ca8a690c2cc2"},
          {"name": "trainer-state.bin", "bytes": 27702, "sha256": "2250fbbbfbd6a77d8bf06acd6d8db67b7fe642bc7550b3f81efcf11cb5dfce36"}
        ]
      },
      {
        "architecture_id": "specialist-router-v1",
        "role": "matched-learned-architecture-comparison",
        "parameter_count": 1457520,
        "run_seed": 1636894266,
        "update": 32,
        "checkpoint_id": "458b2b1413ca483cb9b061518ce9d80e5e9afc85852a66015d81da07bcc7fd2f",
        "files": [
          {"name": "COMMITTED", "bytes": 65, "sha256": "6658855c4fc5a565188474b79cac0f8a0eb8dae2da8d95f452578527e0afb102"},
          {"name": "m22.manifest", "bytes": 802, "sha256": "dba54376419477da7f3f7c34ae8c6ca9c9432e9b475955aa2de165df3e115ecf"},
          {"name": "model.pt", "bytes": 5882820, "sha256": "97ee5a0ad5ab65df9d729318b0423b55bf7a7b57c09e5aaf1726eceb28990595"},
          {"name": "optimizer.pt", "bytes": 11538679, "sha256": "156599a49fa761107cd5ace9861ca451e2d863fbe2891a626eae59570ab462ee"},
          {"name": "runtime.pt", "bytes": 10863, "sha256": "f558519ab08348ab70e5d762c33497574a3335ed76c3db0889f4c665b3222ae2"},
          {"name": "selection.json", "bytes": 103, "sha256": "b8301da160f25aa27f759abc4da50f212d90e7bcc03c5f1989e1ca8a690c2cc2"},
          {"name": "trainer-state.bin", "bytes": 27702, "sha256": "0c258ca38ab998c2580c098479e5e68c9ce1a1851bfdc9b5f645da51bb78d213"}
        ]
      }
    ],
    "load_test": "optimizer-model-runtime-selection-and-trainer-state-resume-smoke-for-both-architectures",
    "publication": "both-exact-checkpoints-are-required-release-payloads"
  },
  "deployment_packages": {
    "format": "openttd-rl-v2-deployment-package-1",
    "compatibility_version": 1,
    "directory": "models/<package-id>",
    "id_algorithm": "sha256-canonical-manifest-without-package-id-v1",
    "maximum_file_bytes": 67108864,
    "complete_inventory": "manifest-plus-exact-payload-list-no-symlinks-no-unknown-files",
    "payload_files": [
      "model.onnx",
      "golden.jsonl",
      "evaluation.json",
      "INSTALL.md",
      "MODEL_CARD.md"
    ],
    "architectures": [
      {
        "architecture_id": "monolithic-generalist-v1",
        "architecture_version": 1,
        "checkpoint_id": "03894fd1238b69b6724d82eb441380312be4e8226efa602fa5e43972f7fa9f5f",
        "role": "accepted-default-in-game-policy"
      },
      {
        "architecture_id": "specialist-router-v1",
        "architecture_version": 1,
        "checkpoint_id": "458b2b1413ca483cb9b061518ce9d80e5e9afc85852a66015d81da07bcc7fd2f",
        "role": "published-matched-comparison"
      }
    ],
    "graph": {
      "format": "ONNX",
      "opset": 18,
      "onnxruntime": "1.28.0",
      "dynamic_axis": "batch-only-positive-bounded-1-through-32",
      "training_nodes": "forbidden",
      "optimizer_state": "forbidden",
      "inputs": [
        {"name": "public_features", "dtype": "float32", "shape": ["batch", 32]},
        {"name": "program_mask", "dtype": "bool", "shape": ["batch", 17]},
        {"name": "hidden_state", "dtype": "float32", "shape": ["batch", 256]},
        {"name": "recurrent_reset", "dtype": "bool", "shape": ["batch"]}
      ],
      "outputs": [
        {"name": "program_logits", "dtype": "float32", "shape": ["batch", 17]},
        {"name": "program_value", "dtype": "float32", "shape": ["batch"]},
        {"name": "next_hidden", "dtype": "float32", "shape": ["batch", 256]}
      ]
    },
    "adapter": {
      "source": "M22-public-32-feature-boundary-generalized-to-batch-and-recurrent-state",
      "learned_scope": "recurrent-17-program-selection-only",
      "normalization": "already-normalized-public-float32-features-no-runtime-fitting",
      "mask": "boolean-at-least-one-legal-program-per-row-illegal-logits-minus-1e9",
      "reset": "true-row-zeros-hidden-before-GRUCell-false-row-carries-hidden",
      "base_and_program_projection": "exact-M22-evaluation-input-construction",
      "unused_training_heads": "base-family-base-candidate-and-base-value-outputs-not-exported-but-shared-encoder-and-GRU-remain-live",
      "nonfinite": "reject-before-inference"
    },
    "installation": {
      "root": "openttd-rl/models/<package-id>",
      "atomic": "copy-to-temporary-validate-rename",
      "uninstall": "remove-exact-content-addressed-package-directory",
      "unknown_files": "reject",
      "training_dependencies": "forbidden"
    },
    "dependency_boundary": {
      "required": ["OpenTTD-runtime", "ONNX-Runtime-CPU", "OpenSSL-Crypto"],
      "forbidden": ["LibTorch", "Python-runtime", "CUDA", "optimizer", "trainer"],
      "python_role": "export-validation-and-acceptance-orchestration-only"
    }
  },
  "equivalence": {
    "runtimes": ["native-libtorch-cpu", "standalone-onnxruntime-cpu", "source-integrated-ingame-onnxruntime-cpu"],
    "architectures": ["monolithic-generalist-v1", "specialist-router-v1"],
    "cases_per_architecture": 24,
    "total_architecture_cases": 48,
    "generation": {
      "domain": "openttd-rl-v2-m23-golden-v1",
      "ordinal_start": 0,
      "seed_count": 48,
      "canonical_encoding": "compact-sorted-json-lines-one-LF-per-record",
      "post_result_case_change": "forbidden"
    },
    "case_classes": [
      {"id": "public-final-projection", "count_per_architecture": 8},
      {"id": "recurrent-sequence-and-reset", "count_per_architecture": 8},
      {"id": "finite-boundary-and-mask-adversarial", "count_per_architecture": 8}
    ],
    "coverage": {
      "batch_sizes": [1, 8, 32],